{
  "manifestId": "aionis-operating-system",
  "version": "1.4.0",
  "status": "draft",
  "constitutionVersion": "1.0.0",
  "documents": [
    "docs/aionis-operating-system/00-START-HERE.md",
    "docs/aionis-operating-system/01-governance-and-non-negotiables.md",
    "docs/aionis-operating-system/02-system-boundaries.md",
    "docs/aionis-operating-system/03-agent-team-and-orchestration.md",
    "docs/aionis-operating-system/04-feature-lifecycle.md",
    "docs/aionis-operating-system/05-human-approval-gates.md",
    "docs/aionis-operating-system/06-knowledge-and-memory-architecture.md",
    "docs/aionis-operating-system/07-evidence-lineage-and-versioning.md",
    "docs/aionis-operating-system/08-development-dreaming.md",
    "docs/aionis-operating-system/09-human-pattern-dreaming.md",
    "docs/aionis-operating-system/10-global-intelligence-learning.md",
    "docs/aionis-operating-system/11-security-and-privacy.md",
    "docs/aionis-operating-system/12-model-routing-cost-and-capacity.md",
    "docs/aionis-operating-system/13-analytics-and-observability.md",
    "docs/aionis-operating-system/14-release-and-environment-strategy.md",
    "docs/aionis-operating-system/15-quality-gates-and-definition-of-done.md",
    "docs/aionis-operating-system/16-complete-implementation-roadmap.md"
  ],
  "contracts": [
    {"contractId": "agent-contract", "version": "1.0.0", "path": "docs/aionis-operating-system/schemas/agent-contract.schema.json"},
    {"contractId": "analytics-contract", "version": "1.0.0", "path": "docs/aionis-operating-system/schemas/analytics-contract.schema.json"},
    {"contractId": "analytics-event", "version": "1.0.0", "path": "docs/aionis-operating-system/schemas/analytics-event.schema.json"},
    {"contractId": "approval-record", "version": "1.0.0", "path": "docs/aionis-operating-system/schemas/approval-record.schema.json"},
    {"contractId": "dream-proposal", "version": "1.0.0", "path": "docs/aionis-operating-system/schemas/dream-proposal.schema.json"},
    {"contractId": "evidence-record", "version": "1.0.0", "path": "docs/aionis-operating-system/schemas/evidence-record.schema.json"},
    {"contractId": "feature-specification", "version": "1.0.0", "path": "docs/aionis-operating-system/schemas/feature-specification.schema.json"},
    {"contractId": "generation-manifest", "version": "1.0.0", "path": "docs/aionis-operating-system/schemas/generation-manifest.schema.json"},
    {"contractId": "memory-record", "version": "1.0.0", "path": "docs/aionis-operating-system/schemas/memory-record.schema.json"},
    {"contractId": "operating-system-manifest", "version": "1.0.0", "path": "docs/aionis-operating-system/schemas/operating-system-manifest.schema.json"},
    {"contractId": "pattern-ledger", "version": "1.0.0", "path": "docs/aionis-operating-system/schemas/pattern-ledger.schema.json"},
    {"contractId": "release-manifest", "version": "1.0.0", "path": "docs/aionis-operating-system/schemas/release-manifest.schema.json"}
  ],
  "capabilities": [
    {"capabilityId": "student-chart-calculation", "owner": "student-app", "target": "PUBLIC_STUDENT_APP", "contractVersion": "1.0.0", "implementationStatus": "implemented", "requiredGate": "CODE_GATE", "relevantSource": "lib/numerology.ts", "dependencies": []},
    {"capabilityId": "student-auth-and-people", "owner": "student-app", "target": "PUBLIC_STUDENT_APP", "contractVersion": "1.0.0", "implementationStatus": "implemented", "requiredGate": "CODE_GATE", "relevantSource": "features/auth/AuthProvider.tsx", "dependencies": []},
    {"capabilityId": "student-pwa-and-print", "owner": "student-app", "target": "PUBLIC_STUDENT_APP", "contractVersion": "1.0.0", "implementationStatus": "implemented", "requiredGate": "CODE_GATE", "relevantSource": "app/page.tsx", "dependencies": ["student-chart-calculation"]},
    {"capabilityId": "development-ai-workflow", "owner": "development-operations", "target": "DEV_TOOLING", "contractVersion": "1.0.0", "implementationStatus": "implemented", "requiredGate": "CODE_GATE", "relevantSource": ".agents/skills/aionis-ai-workflow/SKILL.md", "dependencies": []},
    {"capabilityId": "shared-contract-validation", "owner": "shared-contract-governance", "target": "SHARED_CONTRACT", "contractVersion": "1.0.0", "implementationStatus": "implemented", "requiredGate": "CODE_GATE", "relevantSource": ".agents/skills/aionis-operating-system/scripts/validate-contracts.mjs", "dependencies": ["development-ai-workflow"]},
    {"capabilityId": "owner-console-review", "owner": "owner-operations", "target": "PRIVATE_OWNER_CONSOLE", "contractVersion": "1.0.0", "implementationStatus": "implemented", "requiredGate": "CODE_GATE", "relevantSource": "docs/ARCHITECTURE.md", "dependencies": []},
    {"capabilityId": "build-dependency-maintenance", "owner": "development-operations", "target": "DEV_TOOLING", "contractVersion": "1.0.0", "implementationStatus": "planned", "requiredGate": "CODE_GATE", "relevantSource": "docs/aionis-operating-system/audits/recommended-pr-sequence.md", "dependencies": []},
    {"capabilityId": "future-default-privilege-hardening", "owner": "private-platform", "target": "PRIVATE_AIONIS_BACKEND", "contractVersion": "1.0.0", "implementationStatus": "implemented", "requiredGate": "RELEASE_GATE", "relevantSource": "supabase/migrations/20260804191700_harden_postgres_default_privileges.sql", "dependencies": ["shared-contract-validation"]},
    {"capabilityId": "orchestrator-lifecycle", "owner": "development-operations", "target": "DEV_TOOLING", "contractVersion": "1.0.0", "implementationStatus": "implemented", "requiredGate": "CODE_GATE", "relevantSource": ".agents/skills/aionis-operating-system/scripts/orchestrator/cli.mjs", "dependencies": ["shared-contract-validation"]},
    {"capabilityId": "evidence-lineage", "owner": "private-platform", "target": "PRIVATE_AIONIS_BACKEND", "contractVersion": "1.0.0", "implementationStatus": "implemented", "requiredGate": "CODE_GATE", "relevantSource": ".agents/skills/aionis-operating-system/scripts/evidence-lineage/core.mjs", "dependencies": ["shared-contract-validation"]},
    {"capabilityId": "personal-memory", "owner": "private-platform", "target": "PRIVATE_AIONIS_BACKEND", "contractVersion": "1.0.0", "implementationStatus": "blocked", "requiredGate": "PLAN_GATE", "relevantSource": "docs/aionis-operating-system/06-knowledge-and-memory-architecture.md", "dependencies": ["evidence-lineage", "future-default-privilege-hardening"]},
    {"capabilityId": "runtime-intelligence", "owner": "private-platform", "target": "PRIVATE_AIONIS_BACKEND", "contractVersion": "1.0.0", "implementationStatus": "planned", "requiredGate": "PLAN_GATE", "relevantSource": "docs/aionis-operating-system/12-model-routing-cost-and-capacity.md", "dependencies": ["personal-memory"]},
    {"capabilityId": "analytics-observability", "owner": "analytics-governance", "target": "PRIVATE_AIONIS_BACKEND", "contractVersion": "1.0.0", "implementationStatus": "planned", "requiredGate": "PLAN_GATE", "relevantSource": "docs/aionis-operating-system/13-analytics-and-observability.md", "dependencies": ["personal-memory"]},
    {"capabilityId": "development-dreaming", "owner": "development-operations", "target": "DEV_TOOLING", "contractVersion": "1.0.0", "implementationStatus": "planned", "requiredGate": "DREAM_GATE", "relevantSource": "docs/aionis-operating-system/08-development-dreaming.md", "dependencies": ["orchestrator-lifecycle", "evidence-lineage"]},
    {"capabilityId": "human-pattern-dreaming", "owner": "private-platform", "target": "PRIVATE_AIONIS_BACKEND", "contractVersion": "1.0.0", "implementationStatus": "planned", "requiredGate": "DREAM_GATE", "relevantSource": "docs/aionis-operating-system/09-human-pattern-dreaming.md", "dependencies": ["personal-memory", "runtime-intelligence"]},
    {"capabilityId": "global-learning", "owner": "intelligence-governance", "target": "PRIVATE_AIONIS_BACKEND", "contractVersion": "1.0.0", "implementationStatus": "planned", "requiredGate": "DREAM_GATE", "relevantSource": "docs/aionis-operating-system/10-global-intelligence-learning.md", "dependencies": ["analytics-observability", "human-pattern-dreaming"]},
    {"capabilityId": "staged-release-pipeline", "owner": "release-operations", "target": "DEV_TOOLING", "contractVersion": "1.0.0", "implementationStatus": "planned", "requiredGate": "RELEASE_GATE", "relevantSource": "docs/aionis-operating-system/14-release-and-environment-strategy.md", "dependencies": ["orchestrator-lifecycle", "runtime-intelligence", "analytics-observability", "development-dreaming", "human-pattern-dreaming", "global-learning", "build-dependency-maintenance"]}
  ],
  "supersedes": null,
  "updatedAt": "2026-08-04T20:44:10Z",
  "approvalIds": []
}
